{
    "$schema": "https://schemas.kicad.org/erc.v1.json",
    "coordinate_units": "mm",
    "date": "2026-09-22T21:54:45",
    "ignored_checks": [
        {
            "description": "Global label only appears once in the schematic",
            "key": "single_global_label"
        },
        {
            "description": "Four connection points are joined together",
            "key": "four_way_junction"
        },
        {
            "description": "Footprint link issue",
            "key": "footprint_link_issues"
        },
        {
            "description": "Assigned footprint doesn't match footprint filters",
            "key": "footprint_filter"
        }
    ],
    "included_severities": [
        "error",
        "warning"
    ],
    "kicad_version": "10.99.0",
    "sheets": [
        {
            "path": "/",
            "uuid_path": "/64c481bc-ea0a-4f9c-a176-3729f4987c58",
            "violations": [
                {
                    "description": "Input Power pin not driven by any Output Power pins",
                    "items": [
                        {
                            "description": "Symbol #PWR01 Hidden pin 1 [GND, Power input, Line]",
                            "pos": {
                                "x": 119.38,
                                "y": 96.52
                            },
                            "uuid": "d244be40-4f72-4136-9d69-8cadcdfa193b"
                        }
                    ],
                    "severity": "error",
                    "type": "power_pin_not_driven"
                },
                {
                    "description": "Input Power pin not driven by any Output Power pins",
                    "items": [
                        {
                            "description": "Symbol U1 Pin 5 [V+, Power input, Line]",
                            "pos": {
                                "x": 140.97,
                                "y": 71.12
                            },
                            "uuid": "0123f423-4b4c-467f-8b7d-43421b82330d"
                        }
                    ],
                    "severity": "error",
                    "type": "power_pin_not_driven"
                },
                {
                    "description": "The current configuration does not include the symbol library 'Connector'",
                    "items": [
                        {
                            "description": "Symbol J1 [Conn_01x01_Pin]",
                            "pos": {
                                "x": 105.41,
                                "y": 63.5
                            },
                            "uuid": "203ec3c1-122c-4087-8f6d-2a0dd0b941e6"
                        }
                    ],
                    "severity": "warning",
                    "type": "lib_symbol_issues"
                },
                {
                    "description": "The current configuration does not include the symbol library 'Connector'",
                    "items": [
                        {
                            "description": "Symbol J2 [Conn_01x01_Pin]",
                            "pos": {
                                "x": 105.41,
                                "y": 76.2
                            },
                            "uuid": "2a9f5f63-d864-4898-ae3e-539c635e8f2c"
                        }
                    ],
                    "severity": "warning",
                    "type": "lib_symbol_issues"
                },
                {
                    "description": "The current configuration does not include the symbol library 'Connector'",
                    "items": [
                        {
                            "description": "Symbol J4 [Conn_01x01_Pin]",
                            "pos": {
                                "x": 105.41,
                                "y": 99.06
                            },
                            "uuid": "789295bb-2cfb-4a2b-977f-b3831d5aa975"
                        }
                    ],
                    "severity": "warning",
                    "type": "lib_symbol_issues"
                },
                {
                    "description": "The current configuration does not include the symbol library 'Amplifier_Operational'",
                    "items": [
                        {
                            "description": "Symbol U1 [TLV2371DBV]",
                            "pos": {
                                "x": 143.51,
                                "y": 78.74
                            },
                            "uuid": "b8a40376-5e4f-459f-9886-5e9ee83698cf"
                        }
                    ],
                    "severity": "warning",
                    "type": "lib_symbol_issues"
                },
                {
                    "description": "The current configuration does not include the symbol library 'Connector'",
                    "items": [
                        {
                            "description": "Symbol J3 [Conn_01x01_Pin]",
                            "pos": {
                                "x": 177.8,
                                "y": 78.74
                            },
                            "uuid": "9efa520e-00e1-47a2-b8dc-bf8e2121d065"
                        }
                    ],
                    "severity": "warning",
                    "type": "lib_symbol_issues"
                }
            ]
        }
    ],
    "source": "basic_test.kicad_sch"
}
